{
  "schema_version": "1",
  "artifact_type": "agent_run",
  "runtime": "opencode",
  "role": "conductor",
  "runtime_version": "1.2.3",
  "issue": 33,
  "attempt": 1,
  "pid": 12345,
  "started_at": "2026-07-12T00:00:00Z",
  "updated_at": "2026-07-12T00:00:01Z",
  "status": "exited",
  "exit_code": 0
}
